股票名称,股票代码,新闻时间,新闻标题,简要内容,查询时间,情感分数,相关性,影响度,预期差,情感方向,情感分析时间,日期
腾讯控股,0700.HK,2026-03-03 10:18:02,The AI Conversation ETF That’s Outpacing the Nasdaq Right Now,"While the Nasdaq-100 has slipped 1.14% so far in 2026, the Roundhill Generative AI & Technology ETF has put up an 8.36% gain year-to-date through February 27. That gap is worth understanding, because the forces driving it are not guaranteed to hold. Roundhill Generative AI & Technology ETF (NYSEARCA:CHAT) launched in May 2023 to solve ... The AI Conversation ETF That’s Outpacing the Nasdaq Right Now",2026-03-04 06:25:15,0.03,0.2,0.15,0.0,0.2,2026-03-04 06:26:22,2026-03-03
比亚迪股份,1211.HK,2026-03-03 09:21:42,Geely Extends Lead Over BYD As Gen Z Embraces Chinese EV Brands,"Geely Automobile Holdings extended its sales lead over BYD for a second straight month as China’s EV market cooled. New research shows growing interest in Chinese brands like Geely among Gen Z car buyers, including for cost focused EVs. The shift points to changing consumer preferences at home and abroad, with younger shoppers more open to Chinese nameplates. Geely Automobile Holdings (SEHK:175) is drawing attention after pulling ahead of BYD again, even as China’s broader EV market slows...",2026-03-04 06:25:15,-3.375,0.9,0.75,-0.4,-0.6,2026-03-04 06:26:26,2026-03-03
比亚迪股份,1211.HK,2026-03-02 23:14:58,Tesla’s Robotics And Robotaxi Shift Reshapes Risk Profile For Investors,"Tesla is preparing to launch its Optimus Gen 3 humanoid robot, signaling a push into robotics and physical AI alongside its core EV business. The company is facing legal actions and regulatory scrutiny tied to its robotaxi rollout, including permit questions and lawsuits over autonomous driving incidents. Tesla is reporting crash data related to its autonomous efforts to NHTSA, drawing closer attention from U.S. safety regulators. Market share pressures are playing out differently by region,...",2026-03-04 06:25:15,-0.0699999999999999,0.4,0.35,0.1,-0.2,2026-03-04 06:26:30,2026-03-02
建设银行,0939.HK,2026-03-02 22:51:40,Chinese banks freeze accounts over single words,Social media platforms are buzzing with reports from citizens in China who have found themselves locked out of their own money. The trigger for these financial freezes is surprisingly simple: typing words like “Dogecoin” or “USDT” into the memo field of a standard bank transfer. According to these ...,2026-03-04 06:25:15,-3.9,0.8,0.75,-0.6,-0.7,2026-03-04 06:26:34,2026-03-02
比亚迪股份,1211.HK,2026-03-02 21:48:04,"Tesla's China EV Rivals Hit By Lunar New Year Holidays, But Nio Stands Out","Tesla China EV rivals BYD, XPeng, Nio, Xiaomi and Li Auto saw weaker February sales vs. January amid Lunar New Year holidays.",2026-03-03 06:24:10,-1.4850000000000003,0.9,0.55,-0.2,-0.4,2026-03-03 06:24:52,2026-03-02
小米集团-W,1810.HK,2026-03-02 21:48:04,"Tesla's China EV Rivals Hit By Lunar New Year Holidays, But Nio Stands Out","Tesla China EV rivals BYD, XPeng, Nio, Xiaomi and Li Auto saw weaker February sales vs. January amid Lunar New Year holidays.",2026-03-03 06:24:10,-1.2000000000000002,0.8,0.5,-0.2,-0.4,2026-03-03 06:24:47,2026-03-02
阿里巴巴-SW,9988.HK,2026-03-02 21:38:42,"Earnings live: MongoDB stock tumbles, Norwegian Cruise Line sinks, with Target earnings on deck","The S&P 500 was on track for double-digit earnings growth, with more than half of companies having reported Q4 results so far.",2026-03-03 06:24:10,0.0,0.1,0.05,0.0,0.0,2026-03-03 06:24:55,2026-03-02
比亚迪股份,1211.HK,2026-03-02 21:37:00,Chinese EV Sales Slow Dramatically. What That Means for Tesla Stock.,"Combined, NIO, Li, and XPeng delivered 62,474 cars, down 10.6% from a year ago. It was the worst monthly combined performance since January 2023.",2026-03-03 06:24:10,-1.125,0.45,0.5,-0.4,-0.6,2026-03-03 06:24:59,2026-03-02
阿里巴巴-SW,9988.HK,2026-03-02 20:47:12,Signal Says Alibaba Stock Could Bounce Off Bullish Trendline,The 260-day moving average could catapult BABA higher,2026-03-03 06:24:10,4.15625,0.95,0.7,0.4,0.85,2026-03-03 06:25:03,2026-03-02
比亚迪股份,1211.HK,2026-03-02 20:13:37,"No cap: Nearly 70% of Gen Z would consider Chinese cars like BYD and Geely, study finds","If Chinese automakers eventually break into the US market, younger Gen Z buyers could be first in line.",2026-03-03 06:24:10,2.99,0.8,0.65,0.4,0.75,2026-03-03 06:25:07,2026-03-02
小米集团-W,1810.HK,2026-03-02 20:13:37,"No cap: Nearly 70% of Gen Z would consider Chinese cars like BYD and Geely, study finds","If Chinese automakers eventually break into the US market, younger Gen Z buyers could be first in line.",2026-03-03 06:24:10,0.0,0.2,0.1,0.0,0.0,2026-03-03 06:25:11,2026-03-02
阿里巴巴-SW,9988.HK,2026-03-02 19:11:48,Alibaba AI Coding Platform And Chip Put Cloud Margins In Focus,"Alibaba Group Holding (NYSE:BABA) has introduced a low cost AI powered coding subscription that uses its own AI models and in house AI chip. The new platform is designed to support developers and enterprises, with the chip tailored for AI workloads in Alibaba's cloud environment. The launch highlights the company's latest push into AI tools and infrastructure within China’s competitive technology sector. For investors tracking NYSE:BABA, this move comes as the shares recently closed at...",2026-03-03 06:24:10,4.21875,0.9,0.75,0.45,0.8,2026-03-03 06:25:14,2026-03-02
小米集团-W,1810.HK,2026-03-02 16:00:05,"Memory inflation likely to hit laptop prices more than smartphones, analysts reckon","Xiaomi kept prices steady year-on-year for its newly launched 17 and 17 Ultra smartphones, despite rising memory costs, in a move that underlines the sensitivity of consumer demand to price increases. The Chinese handset maker unveiled the models over the weekend, maintaining pricing levels...",2026-03-03 06:24:10,4.095000000000001,0.9,0.7,0.5,0.8,2026-03-03 06:25:18,2026-03-02
汇丰银行,0005.HK,2026-03-02 12:07:52,Ex-CBI boss Dame Carolyn Fairbairn to become chair of HSBC UK,Dame Clara Furse is set to retire from the role of non-executive chair in the coming months after nine years.,2026-03-03 06:24:10,1.6200000000000003,0.9,0.45,0.2,0.6,2026-03-03 06:25:22,2026-03-02
中国海洋石油,0883.HK,2026-03-02 10:02:01,Shanghai Stocks Hit 10-Year High While Hong Kong Crypto ETFs Sink,"Shanghai stocks surged to a decade high on Iran conflict trades, widening the gap with Hong Kong crypto ETFs and dimming hopes for Chinese capital inflows.",2026-03-03 06:24:10,0.0,0.2,0.15,0.0,0.0,2026-03-03 06:25:25,2026-03-02
汇丰银行,0005.HK,2026-03-02 04:20:00,"Wall Street Says Forget AI Chips, and Buy AI Software Stocks Instead for 2026",Some analysts think it's time to switch to software stocks. But exiting hardware is probably a mistake.,2026-03-03 06:24:10,0.0,0.1,0.05,0.0,0.0,2026-03-03 06:25:29,2026-03-02
汇丰银行,0005.HK,2026-03-02 03:14:21,Assessing HSBC (LSE:HSBA) Valuation As Share Price Momentum Meets Conflicting Fair Value Estimates,"Without a single headline event driving it today, HSBC Holdings (LSE:HSBA) still attracts attention as a global bank with £63,224m in revenue and £21,102m in net income, alongside a long trading history. See our latest analysis for HSBC Holdings. At a £13.94 share price, HSBC’s recent 7 day share price return of 8.03% and 90 day share price return of 29.08% compare with a very large 5 year total shareholder return. This suggests momentum has been strong over both shorter and longer...",2026-03-03 06:24:10,1.4400000000000002,0.9,0.4,0.2,0.6,2026-03-03 06:25:33,2026-03-02
小米集团-W,1810.HK,2026-03-01 21:10:46,Is Xiaomi (SEHK:1810) Offering A Valuation Opportunity After Recent Share Price Weakness,"If you are wondering whether Xiaomi's current share price really reflects what the business is worth, you are not alone, the stock's recent history gives plenty to think about. The shares last closed at HK$34.9, with returns of 1.3% decline over 7 days, 4.7% decline over 30 days, 13.4% decline year to date, 32.7% decline over 1 year and 176.5% over 3 years plus 42.7% over 5 years, a mix that can change how investors think about both risk and potential. Recent coverage has continued to focus...",2026-03-02 06:20:39,1.6500000000000004,1.0,0.55,0.2,0.4,2026-03-02 06:21:16,2026-03-01
比亚迪股份,1211.HK,2026-03-01 17:24:00,Chinese EV Sales Slow Dramatically. What That Means for Tesla Stock.,"Combined, NIO, Li, and XPeng delivered 62,474 cars, down 10.6% year over year. It was the worst monthly combined performance since January 2023.",2026-03-02 06:20:39,-1.125,0.45,0.5,-0.4,-0.6,2026-03-02 06:21:20,2026-03-01
比亚迪股份,1211.HK,2026-03-01 17:04:42,"Tesla's China EV Rivals Hit By Lunar New Year Holidays, But Nio Stands Out","Tesla China EV rivals BYD, XPeng, Nio, Xiaomi and Li Auto saw weaker February sales vs. January amid Lunar New Year holidays.",2026-03-02 06:20:39,-1.4850000000000003,0.9,0.55,-0.2,-0.4,2026-03-02 06:21:28,2026-03-01
小米集团-W,1810.HK,2026-03-01 17:04:42,"Tesla's China EV Rivals Hit By Lunar New Year Holidays, But Nio Stands Out","Tesla China EV rivals BYD, XPeng, Nio, Xiaomi and Li Auto saw weaker February sales vs. January amid Lunar New Year holidays.",2026-03-02 06:20:39,-1.2000000000000002,0.8,0.5,-0.2,-0.4,2026-03-02 06:21:24,2026-03-01
比亚迪股份,1211.HK,2026-03-01 16:30:32,Tesla Sales In Freefall—Here's What Prediction Markets Say About The Company's Robotaxi Lifeline,"Tesla Inc (NASDAQ:TSLA) has posted its 13th consecutive month of declining sales in Europe while rival BYD Company (OTC:BYDDY) more than doubled its market share. Tesla’s European Collapse Tesla’s new car registrations across the EU, UK and EFTA fell 17% year-on-year in January to just 8,075 units. Market share slipped to 0.8%, down from 1% a year earlier. But registrations only capture one month’s snapshot. Actual sales tell a darker story. Don't Miss: This Energy Storage Company Already Has $1",2026-03-02 06:20:39,4.4625,0.85,0.75,0.6,0.8,2026-03-02 06:21:31,2026-03-01
腾讯控股,0700.HK,2026-03-01 02:36:07,China’s annual policy summit to focus on tech shift and debt issuance,"Investing.com – China is expected to set a 2026 economic growth target of 4.5%–5.0% during its upcoming National People’s Congress (NPC), signaling that policymakers may be willing to accept a slower expansion in exchange for long-term structural health.",2026-03-02 06:20:39,0.21,0.4,0.35,0.1,0.2,2026-03-02 06:21:35,2026-03-01
腾讯控股,0700.HK,2026-02-28 16:55:27,"VNET Group, Inc. (VNET): A Bull Case Theory","We came across a bullish thesis on VNET Group, Inc. on Agon Investments’s Substack. In this article, we will summarize the bulls’ thesis on VNET. VNET Group, Inc.’s share was trading at $11.85 as of February 20th. VNET’s forward P/E was 25.64 according to Yahoo Finance. VNET Group, Inc. sits at the center of China’s AI infrastructure supercycle, providing hosting and […]",2026-03-02 06:20:39,0.0,0.1,0.05,0.0,0.0,2026-03-02 06:21:39,2026-02-28
阿里巴巴-SW,9988.HK,2026-02-28 13:08:02,Alibaba AI Push And Chip Effort Meet Discounted Valuation On BABA Stock,"Alibaba Group Holding (NYSE:BABA) is expanding its AI footprint with a new multi-model AI coding subscription from its cloud division. The service places several leading open-source AI models into a single plan for enterprise developers. Alibaba is also rolling out a self-developed AI chip designed for training and inference workloads. The chip effort is intended to lessen dependence on external suppliers, including those affected by export restrictions. For you as an investor, this update...",2026-03-02 06:20:39,4.453124999999999,0.95,0.75,0.45,0.8,2026-03-02 06:21:43,2026-02-28
汇丰银行,0005.HK,2026-02-28 12:36:14,HSBC Q4 Earnings Call Highlights,"HSBC (NYSE:HSBC) used its full-year 2025 fixed income investor call to highlight record profitability, continued simplification progress, and a balance sheet it described as highly liquid and capital generative, alongside updated medium-term targets and a detailed 2026 debt issuance plan. 2025 fina",2026-03-02 06:20:39,5.0,0.95,0.85,0.6,0.8,2026-03-02 06:21:47,2026-02-28
香港交易所,0388.HK,2026-02-28 04:26:49,Assessing Hong Kong Exchanges And Clearing (SEHK:388) Valuation After A Strong 1 Year Shareholder Return,"What stands out about Hong Kong Exchanges and Clearing right now Hong Kong Exchanges and Clearing (SEHK:388) has drawn attention recently as investors weigh its latest share price of HK$419 against its recent returns, including a 1 day move of 0.9% and a past year total return of 23%. See our latest analysis for Hong Kong Exchanges and Clearing. For investors, the picture is mixed, with a 1 year total shareholder return of 23%, a 30 day share price return of a 4.6% decline, and a 5 year total...",2026-03-02 06:20:39,2.9331249999999995,0.95,0.65,0.4,0.55,2026-03-02 06:21:51,2026-02-28
香港交易所,0388.HK,2026-02-28 01:02:13,Hong Kong Exchanges and Clearing Ltd (HKXCF) (Full Year 2025) Earnings Call Highlights: Record ...,"Hong Kong Exchanges and Clearing Ltd (HKXCF) reports a stellar financial year with significant growth in revenue, profit, and market activities, while navigating challenges and strategic investments.",2026-03-02 06:20:39,5.0,1.0,0.85,0.6,0.9,2026-03-02 06:21:55,2026-02-28
阿里巴巴-SW,9988.HK,2026-02-27 22:45:04,Alibaba (BABA) Sees a More Significant Dip Than Broader Market: Some Facts to Know,"The latest trading day saw Alibaba (BABA) settling at $144.11, representing a -2.66% change from its previous close.",2026-03-02 06:20:39,-1.4,1.0,0.4,-0.2,-0.5,2026-03-02 06:21:59,2026-02-27
阿里巴巴-SW,9988.HK,2026-02-27 22:42:00,"Buy the Dip in Nvidia Stock After Q4 Earnings, or is it Too Soon?","Despite posting blowout quarterly results as usual, Nvidia stock is now down over 6% since its Q4 report on Wednesday amid AI sustainability concerns.",2026-03-02 06:20:39,0.0,0.2,0.1,0.0,0.0,2026-03-02 06:22:02,2026-02-27
汇丰银行,0005.HK,2026-02-27 15:50:25,Strengthen Your Passive Income Stream with High-Yielding REITs,"With all of the chaos in the markets, it’s a good idea to protect your portfolio and generate income with high-yielding stocks. Look at real estate investment trusts (REITs), for example. For one, most are a great hedge against inflation. After all, when inflation rises, so do a lot of rents. Two, we’re seeing a ... Strengthen Your Passive Income Stream with High-Yielding REITs",2026-03-02 06:20:39,0.0,0.1,0.05,0.0,0.0,2026-03-02 06:22:06,2026-02-27
小米集团-W,1810.HK,2026-02-27 14:27:33,Xiaomi launches safety advisory committee after EV accidents in China,"BEIJING, Feb 27 () - Chinese electric vehicle maker Xiaomi said on Friday that it will set up a committee of advisers to assess the ‌safety of its cars, as it moves to combat rising criticism over ‌a recent spate of accidents. The company also plans to hold regular meetings with car owners, media and experts ​to hear their suggestions regarding the safety of its vehicles, with the first session set for the first half of this year, Hou Jinglei, head of Xiaomi's EV safety department, said during a",2026-03-02 06:20:39,-3.384375,0.95,0.75,-0.4,-0.55,2026-03-02 06:22:10,2026-02-27
汇丰银行,0005.HK,2026-02-27 13:25:55,"BCA turns neutral on U.S. stocks, following HSBC","Investing.com -- BCA Research has shifted its stance on U.S. equities to neutral, mirroring a similar move by HSBC on thursday, after revised employment data showed the labour market had been far weaker than previously understood.",2026-03-02 06:20:39,0.0,0.2,0.25,0.0,0.0,2026-03-02 06:22:13,2026-02-27
美团-W,3690.HK,2026-02-27 01:13:57,Is It Time To Reassess Meituan (SEHK:3690) After Its Prolonged Share Price Slide?,"If you are wondering whether Meituan's current share price still reflects its long term potential or if the market has simply become too cautious, a closer look at what you are paying for each unit of business performance can be very revealing. Meituan's share price recently closed at HK$80.45, with returns of 1.9% decline over 7 days, 16.7% decline over 30 days, 23.1% decline year to date, and 53.4% decline over 1 year, extending to 43.1% decline over 3 years and 76.3% decline over 5...",2026-03-02 06:20:39,-5.0,1.0,0.85,-0.7,-0.8,2026-03-02 06:22:17,2026-02-27
腾讯控股,0700.HK,2026-02-26 23:11:24,Is Tencent Holdings (SEHK:700) Pricing Look Attractive After Recent Regulatory Headlines?,"If you are wondering whether Tencent Holdings is offering fair value right now, you are not alone, especially with the stock still closely watched by long term investors. The share price closed at HK$512.0, with returns of a 3.9% decline over 7 days, a 15.7% decline over 30 days, a 17.8% decline year to date, a 4.3% gain over 1 year, a 44.6% gain over 3 years and a 16.9% decline over 5 years, which gives a mixed picture for anyone trying to judge current pricing. Recent headlines have...",2026-03-02 06:20:39,,,,,,,2026-02-26
阿里巴巴-SW,9988.HK,2026-02-26 21:08:00,Payoneer Global Inc (PAYO) Q4 2025 Earnings Call Highlights: Record Revenue Growth and ...,"Payoneer Global Inc (PAYO) reports a 14% revenue growth and a significant shift towards AI-first strategies, despite facing challenges from market transitions and increased operating expenses.",2026-02-27 06:29:57,0.005,0.1,0.05,0.0,0.2,2026-02-27 06:30:34,2026-02-26
汇丰银行,0005.HK,2026-02-26 17:00:03,Are You Looking for a Top Momentum Pick? Why HSBC (HSBC) is a Great Choice,Does HSBC (HSBC) have what it takes to be a top stock pick for momentum investors? Let's find out.,2026-02-27 06:29:57,1.8000000000000005,0.9,0.4,0.2,0.8,2026-02-27 06:30:37,2026-02-26
汇丰银行,0005.HK,2026-02-26 16:25:40,HSBC names generative AI a leading investment area,"The global bank plans to use the technology for employee assistance, process reengineering and customer experience.",2026-02-27 06:29:57,3.7800000000000007,0.9,0.7,0.4,0.8,2026-02-27 06:30:41,2026-02-26
汇丰银行,0005.HK,2026-02-26 15:22:19,"CrowdStrike (CRWD)’s Killing It, Says Jim Cramer","We recently published 12 Stocks on Jim Cramer’s Radar. CrowdStrike Holdings, Inc. (NASDAQ:CRWD) is one of the stocks on Jim Cramer’s radar. CrowdStrike Holdings, Inc. (NASDAQ:CRWD) is a cybersecurity company. Its shares are down by 6.3% over the past year and by 21% year-to-date. The stock tumbled last week after AI firm Anthropic announced a new […]",2026-02-27 06:29:57,0.0,0.1,0.05,0.0,0.0,2026-02-27 06:30:44,2026-02-26
腾讯控股,0700.HK,2026-02-26 15:05:28,Why Baidu Stock Is Falling Today,Investors Question Baidu's AI Ambitions as Earnings Pressure Mounts,2026-02-27 06:29:57,0.0,0.2,0.1,0.0,0.0,2026-02-27 06:30:48,2026-02-26
阿里巴巴-SW,9988.HK,2026-02-26 15:05:28,Why Baidu Stock Is Falling Today,Investors Question Baidu's AI Ambitions as Earnings Pressure Mounts,2026-02-27 06:29:57,0.0,0.2,0.1,0.0,0.0,2026-02-27 06:30:51,2026-02-26
比亚迪股份,1211.HK,2026-02-26 12:27:00,Tesla Europe Woes Continue: Worth Holding on Autonomy Promises?,"Given TSLA's EV slump, massive capex, slow robotaxi rollout and stretched valuation, investors should temper expectations around its long-term AI ambitions.",2026-02-27 06:29:57,0.2449999999999999,0.4,0.35,0.1,0.25,2026-02-27 06:30:55,2026-02-26
腾讯控股,0700.HK,2026-02-26 11:56:00,Baidu Profit Drops as Revenue Decline Continues,"The Chinese search reported sharply lower profit, with revenue declining for a third straight quarter, as it struggles to transform its businesses in the AI era.",2026-02-27 06:29:57,-0.315,0.4,0.35,-0.2,-0.25,2026-02-27 06:31:03,2026-02-26
阿里巴巴-SW,9988.HK,2026-02-26 11:56:00,Baidu Profit Drops as Revenue Decline Continues,"The Chinese search reported sharply lower profit, with revenue declining for a third straight quarter, as it struggles to transform its businesses in the AI era.",2026-02-27 06:29:57,-0.315,0.4,0.35,-0.2,-0.25,2026-02-27 06:30:59,2026-02-26
香港交易所,0388.HK,2026-02-26 11:45:11,Booming markets propel Hong Kong exchange's profits to record high,"Hong Kong's stock exchange reported record profits for the second consecutive year on Thursday, after the finance hub topped the global rankings for initial public offerings in 2025.- Behind the surge -
Hong Kong's IPO market welcomed 119 new listings and raised a total of US$36.7 billion in 2025, a 226 percent year-over-year increase.",2026-02-27 06:29:57,5.0,1.0,0.9,0.7,0.9,2026-02-27 06:31:07,2026-02-26
香港交易所,0388.HK,2026-02-26 08:04:00,HKEX Has Record Year as Hong Kong Reclaims IPO Crown,"Hong Kong hosted 119 new listings last year, raising more than triple the funds raised the previous year.",2026-02-27 06:29:57,5.0,0.95,0.85,0.7,0.9,2026-02-27 06:31:11,2026-02-26
腾讯控股,0700.HK,2026-02-26 03:26:23,Baidu’s Swift $11 Billion Selloff Shows Struggle to Meet AI Hype,"The search engine specialist kicks off December-quarter earnings for China’s Big Tech on Thursday, amid growing concern that its AI investments are not translating into a meaningful growth driver quickly enough.  “In the crowded field of Chinese AI players, Baidu is viewed more as an optionality or valuation‑driven sum‑of‑the-parts story rather than a clearly defined long‑term winner,” said Gary Tan, portfolio manager at Allspring Global Investments LLC. “Baidu must demonstrate it is leveraging its AI capabilities to build a true full stack AI platform rather than acting as a jack of all trades.”  Baidu was among the first Chinese companies to embrace AI and roll out a ChatGPT-like service, but it has lost leadership in the field to larger rivals as well as newcomers like DeepSeek.",2026-02-27 06:29:57,-0.0699999999999999,0.4,0.35,0.1,-0.2,2026-02-27 06:31:14,2026-02-26
中芯国际,0981.HK,2026-02-25 21:11:04,Assessing Taiwan Semiconductor Manufacturing’s Valuation After A Strong Multi‑Period Share Price Run,"Recent performance snapshot for Taiwan Semiconductor Manufacturing (TSM) Taiwan Semiconductor Manufacturing (TSM) has drawn renewed investor attention after a period of strong share performance, with the stock showing gains over the past week, month, past 3 months and year. For context, the shares recently closed at $385.75, with a return of 4.2% over the past day and 5.9% over the past week. Over the past month and past 3 months, the stock shows returns of 15.2% and 33.0%...",2026-02-26 06:29:35,0.0025,0.1,0.05,0.0,0.1,2026-02-26 06:30:12,2026-02-25
腾讯控股,0700.HK,2026-02-25 18:58:36,Nvidia's China Window Remains Closed,"H200 Exports Approved, Not Delivered",2026-02-26 06:29:35,-0.6000000000000001,0.4,0.5,-0.2,-0.4,2026-02-26 06:30:19,2026-02-25
阿里巴巴-SW,9988.HK,2026-02-25 18:58:36,Nvidia's China Window Remains Closed,"H200 Exports Approved, Not Delivered",2026-02-26 06:29:35,-0.315,0.4,0.35,-0.2,-0.25,2026-02-26 06:30:15,2026-02-25
阿里巴巴-SW,9988.HK,2026-02-25 18:55:21,BABA Bundles 4 Models Under One Plan,Alibaba Makes Bold Pricing Move,2026-02-26 06:29:35,4.725,0.9,0.75,0.6,0.8,2026-02-26 06:30:23,2026-02-25
汇丰银行,0005.HK,2026-02-25 18:38:14,AVDE Is Up 43% Over the Past Year and Still Paying Growing Dividends,"Avantis International Equity ETF (NYSEARCA:AVDE) offers investors a low-cost way to access dividend-paying international equities, but with a 2.19% yield, the question for income-focused investors is straightforward: is that distribution durable? How AVDE Generates Income AVDE is a passively managed fund that holds shares in international companies across Europe, Asia-Pacific, and North America. The fund’s ... AVDE Is Up 43% Over the Past Year and Still Paying Growing Dividends",2026-02-26 06:29:35,0.0,0.1,0.05,0.0,0.0,2026-02-26 06:30:27,2026-02-25
比亚迪股份,1211.HK,2026-02-25 18:17:32,Assessing BYD (SEHK:1211) Valuation After Recent Mixed Share Price Performance,"Why BYD’s Recent Share Performance Is Back on Investors’ Radar BYD (SEHK:1211) has come back into focus after a mixed run in its share price, with a slight 1 day decline but small gains over the past week, month, and past 3 months. See our latest analysis for BYD. Looking past the latest 1 day pullback, BYD’s recent share price returns over 3 months and year to date have been relatively muted compared with its 1 year total shareholder return decline of 23.16%. This suggests sentiment has...",2026-02-26 06:29:35,0.64125,0.95,0.45,0.1,0.2,2026-02-26 06:30:31,2026-02-25
汇丰银行,0005.HK,2026-02-25 15:51:13,Moderately bullish activity in Wal-Mart with shares up 1.15%,"Moderately bullish activity in Wal-Mart (WMT), with shares up $1.45, or 1.15%, near $127.25. Options volume relatively light with 32k contracts traded and calls leading puts for a put/call ratio of 0.43, compared to a typical level near 1.06. Implied volatility (IV30) is higher by 0.1 points near 27.22,and above the 52wk median, suggesting an expected daily move of $2.18. Put-call skew steepened, indicating increased demand for downside protection, following a downgrade to Hold at HSBC.Claim 50%",2026-02-26 06:29:35,-2.8,0.8,0.7,-0.4,-0.6,2026-02-26 06:30:35,2026-02-25
汇丰银行,0005.HK,2026-02-25 15:51:00,"HSBC Q4 Pre-Tax Earnings Increase Y/Y on Higher Revenues, Lower ECL","HSBC posts a sharp y/y Q4 profit jump as revenues rise 41% and credit losses fall, while key business lines deliver solid pre-tax growth.",2026-02-26 06:29:35,5.0,1.0,0.85,0.6,0.9,2026-02-26 06:30:38,2026-02-25
