股票名称,股票代码,新闻时间,新闻标题,简要内容,查询时间
建设银行,0939.HK,2025-12-10 09:30:00,JD.com buys into Hong Kong Central tower as Lai Sun offloads US$450 million stak...,"JD.com has agreed to acquire a stake in a major office tower in Hong Kong's Central district, mirroring a property move ...",2026-01-03 06:14:59
工商银行,1398.HK,2025-12-18 05:09:32,Is ICBC Still Attractively Priced After 24% YTD Rally And Beijing Support Measur...,"If you are wondering whether Industrial and Commercial Bank of China is still good value after its big run up, you are n...",2026-01-03 06:14:59
工商银行,1398.HK,2025-12-17 21:09:43,Is ICBC (SEHK:1398) Still Undervalued After Its Strong 12-Month Share Price Run?,Recent performance and why ICBC is on investors’ radar Industrial and Commercial Bank of China SEHK:1398 has quietly del...,2026-01-03 06:14:59
汇丰银行,0005.HK,2026-01-02 18:45:01,Barclay brothers hit with HSBC bankruptcy petition,The Barclay brothers are facing the threat of bankruptcy as HSBC seeks to recover more than £140m from the pair.,2026-01-03 06:14:59
汇丰银行,0005.HK,2025-12-30 18:51:57,"Dear Marvell Stock Fans, Mark Your Calendars for January 7",Worries about Marvell’s future revenue from Amazon and Microsoft could be overdone.,2026-01-03 06:14:59
汇丰银行,0005.HK,2025-12-30 18:15:00,Wells Fargo Advances Multi-Year Simplification Plan to Enhance Returns,"WFC advances a multi-year simplification plan, exiting non-core businesses to cut costs, reallocate capital and enhance ...",2026-01-03 06:14:59
中国电信,0728.HK,2025-12-15 15:09:42,Is China Telecom Still Attractive After a 259.7% Five Year Share Price Surge?,"Wondering if China Telecom is still good value after such a strong run, or if most of the upside is already priced in? L...",2026-01-03 06:14:59
第四范式,6682.HK,2026-01-01 04:35:31,Asian Growth Companies With High Insider Ownership In January 2026,"As of January 2026, the Asian markets are experiencing a period of cautious optimism, with key indices like Japan's Nikk...",2026-01-03 06:14:59
第四范式,6682.HK,2025-12-18 22:34:40,Asian Stocks Estimated To Be Trading Below Fair Value In December 2025,"As global markets navigate a period of fluctuating interest rates and economic uncertainties, Asian stocks have drawn at...",2026-01-03 06:14:59
华虹半导体,1347.HK,2026-01-02 09:30:00,China's top contract chipmakers pursue acquisitions amid Beijing's self-sufficie...,"Hua Hong Semiconductor, China's No 2 contract chipmaker, on Wednesday announced the acquisition of its sister foundry in...",2026-01-03 06:14:59
华虹半导体,1347.HK,2025-12-04 17:04:30,"China's $98 Billion AI Chip Boom: Cambricon's 500,000 Gamble to Replace Nvidia",A seismic power shift is unfolding in AI hardware as China's Cambricon gears up to triple production by 2026.,2026-01-03 06:14:59
中国海洋石油,0883.HK,2025-12-26 09:16:20,PETRONAS signs sale and purchase agreement with CNOOC,"Under the agreement, PETRONAS LNG will deliver one million tonnes per year of liquefied natural gas.",2026-01-03 06:14:59
中国海洋石油,0883.HK,2025-12-24 04:44:49,Petronas Deepens LNG Ties With CNOOC in Long-Term Supply Deal,Malaysia’s national oil company has secured a new long-term LNG supply agreement with a major Chinese buyer.,2026-01-03 06:14:59
中国海洋石油,0883.HK,2025-12-23 13:06:36,Is It Too Late To Consider CNOOC After Its Strong Multi Year Share Price Rally?,"If you are wondering whether CNOOC still represents good value after its big run, or if most of the upside is already pr...",2026-01-03 06:14:59
中芯国际,0981.HK,2026-01-02 09:30:00,China's top contract chipmakers pursue acquisitions amid Beijing's self-sufficie...,"Hua Hong Semiconductor, China's No 2 contract chipmaker, on Wednesday announced the acquisition of its sister foundry in...",2026-01-03 06:14:59
中芯国际,0981.HK,2025-12-31 10:07:35,Hong Kong Stocks Log Best Year Since 2017,"Chinese stocks rallied for a second consecutive year, ending 2025 with hefty gains, boosted by China’s artificial-intell...",2026-01-03 06:14:59
中芯国际,0981.HK,2025-12-23 07:28:06,Global investors turn to Chinese AI as Wall Street fears bubble,"Global investors are increasing their wagers on Chinese artificial intelligence companies, betting on the next DeepSeek ...",2026-01-03 06:14:59
香港交易所,0388.HK,2025-12-22 09:30:00,Charles Li halts Hong Kong IPO plan for Micro Connect fund under HKEX Chapter 21,"Charles Li Xiaojia, former CEO of Hong Kong Exchanges and Clearing (HKEX), has suspended the initial public offering (IP...",2026-01-03 06:14:59
香港交易所,0388.HK,2025-12-22 09:30:00,Hong Kong world's No 1 fundraising venue with US$35.4 billion from 106 listings:...,Funds raised in Hong Kong reached nearly HK$275 billion (US$35.4 billion) from 106 initial public offerings (IPO) as of ...,2026-01-03 06:14:59
香港交易所,0388.HK,2025-12-21 20:05:37,Reassessing Hong Kong Exchanges and Clearing (SEHK:388) Valuation After a Recent...,Recent performance and what is driving interest now Hong Kong Exchanges and Clearing (SEHK:388) has quietly climbed abou...,2026-01-03 06:14:59
腾讯控股,0700.HK,2026-01-02 13:42:06,Baidu Stock Jumps on Plans To List AI Chip Unit Kunlunxin in Hong Kong,Baidu stock jumped Friday after the Chinese tech giant's AI chip division filed for an initial public offering in Hong K...,2026-01-03 06:14:59
腾讯控股,0700.HK,2026-01-02 04:28:00,Baidu’s AI Chip Unit Kunlunxin Plans Hong Kong Listing,"Baidu’s AI chip unit Kunlunxin has confidentially filed an application to list on the Hong Kong stock exchange, the late...",2026-01-03 06:14:59
腾讯控股,0700.HK,2026-01-01 21:20:00,Best Stock to Buy Right Now: Alibaba vs. Tencent,Which of these Chinese tech titans is a more reliable long-term investment?,2026-01-03 06:14:59
阿里巴巴-SW,9988.HK,2026-01-02 19:32:11,Why Alibaba (BABA) Stock Is Climbing Today,"China's AI Push Sends Alibaba Stock Higher, Baidu Spinoff Adds Momentum",2026-01-03 06:14:59
阿里巴巴-SW,9988.HK,2026-01-02 13:42:06,Baidu Stock Jumps on Plans To List AI Chip Unit Kunlunxin in Hong Kong,Baidu stock jumped Friday after the Chinese tech giant's AI chip division filed for an initial public offering in Hong K...,2026-01-03 06:14:59
阿里巴巴-SW,9988.HK,2026-01-02 09:44:03,"Trending tickers: Baidu, TSMC, Orsted and Tesla",The latest investor updates on stocks that are trending on Friday,2026-01-03 06:14:59
美团-W,3690.HK,2025-12-19 09:30:00,Need for speed: Alibaba ramps up China instant commerce push with Cainiao and Tm...,Alibaba Group's logistics arm Cainiao and online grocery business Tmall Supermarket are teaming up to expand fulfilment ...,2026-01-03 06:14:59
美团-W,3690.HK,2025-12-17 10:06:47,Reassessing Meituan (SEHK:3690) After Recent Share Price Stabilisation: Is the M...,Recent performance and what is driving Meituan now Meituan (SEHK:3690) has quietly edged higher over the past week and m...,2026-01-03 06:14:59
美团-W,3690.HK,2025-12-15 15:52:31,Asia's Wealthy Rush Into $200 Billion Structured Bet,"They're chasing double-digit yields--but one wrong move, and they're stuck buying Alibaba at sky-high prices.",2026-01-03 06:14:59
小米集团-W,1810.HK,2026-01-02 15:00:54,Tesla Stock in 2026: Is It Time to Buy or Sell the Electric Giant?,Tesla Stock Has Doubled From Its Lows. Why Analysts Still See Trouble Ahead,2026-01-03 06:14:59
小米集团-W,1810.HK,2026-01-01 01:54:52,Chip shortages threaten 20% rise in consumer electronics prices,"Consumers should prepare for price increases this year, of as much as 20 per cent for smartphones, computers and home ap...",2026-01-03 06:14:59
小米集团-W,1810.HK,2025-12-31 04:43:25,China's CXMT eyes $4.2 billion Shanghai listing to fund DRAM expansion,"China's leading maker of DRAM chips, ChangXin Memory Technologies (CXMT) Corp, said on Tuesday it plans to ​raise 29.5 b...",2026-01-03 06:14:59
地平线机器人,9660.HK,2025-12-26 04:35:54,Asian Growth Companies With Strong Insider Backing In December 2025,"As December 2025 unfolds, the Asian markets are navigating a complex landscape marked by Japan's significant interest ra...",2026-01-03 06:14:59
比亚迪股份,1211.HK,2026-01-02 21:36:39,"Stocks to Watch Friday: Tesla, Baidu, Micron, Wayfair","↗️ Wayfair (W), RH (RH), Williams-Sonoma (WSM): President Trump delayed by a year tariff increases on upholstered furnit...",2026-01-03 06:14:59
比亚迪股份,1211.HK,2026-01-02 21:30:11,Tesla loses EV crown to China's BYD in 2025 as sales slip,"Tesla's sales fell in 2025, the company reported Friday, ceding its position as the world's biggest electric vehicle mak...",2026-01-03 06:14:59
比亚迪股份,1211.HK,2026-01-02 21:20:55,Tesla dethroned as the world's largest EV maker,"The Chinese automaker BYD sold 2.26 million electric vehicles in 2025, surpassing Tesla as the world's top EV seller.",2026-01-03 06:14:59
友邦保险,1299.HK,2025-12-13 20:11:09,Assessing AIA Group’s Valuation After 43% Rally and China Expansion News,"If you are wondering whether AIA Group is still a smart buy after its big run up, or if the easy money has already been ...",2026-01-03 06:14:59
友邦保险,1299.HK,2025-12-12 10:59:00,"Zacks Industry Outlook Highlights AIA Group, Manulife, Lincoln National, Jackson...",AIA Group and peers face muted rates and rising tech costs as product redesigns and digital adoption reshape the life in...,2026-01-03 06:14:59
友邦保险,1299.HK,2025-12-11 17:21:00,5 Life Insurers Stocks to Buy in a Low-Interest Rate Environment,Redesigning and repricing of products and services amid a low rate environment are likely to help Zacks Life Insurance i...,2026-01-03 06:14:59
