股票名称,股票代码,新闻时间,新闻标题,简要内容,查询时间,情感分数,相关性,影响度,预期差,情感方向,情感分析时间,日期
中芯国际,0981.HK,2026-03-13 07:09:24,Assessing Taiwan Semiconductor Manufacturing’s Valuation After A Strong Year And Recent Share Price Pullback,"Why Taiwan Semiconductor Manufacturing is on investors’ radar Taiwan Semiconductor Manufacturing (NYSE:TSM) has recently drawn attention after a strong 1 year total return of 98.289%, set against a mixed pattern of shorter term moves in the share price. Over the past week the stock showed a 4.8465% decline, with a 5.0344% drop in the latest trading day and a 6.9631% decline over the past month, while the past 3 months reflect a 15.2958% gain. See our latest analysis for Taiwan Semiconductor...",2026-03-13 23:57:21,0.0,0.2,0.1,0.0,0.0,2026-03-14 00:02:44,2026-03-13
阿里巴巴-SW,9988.HK,2026-03-13 04:10:21,Alibaba Debuts OpenClaw App to Feed China’s Agentic AI Addiction,"“JVS Claw” helps iOS and Android smartphone users without coding knowledge to instruct AI agents to perform simple real-world tasks, Alibaba said in a statement.  Free for 14 days, it emerged after Baidu Inc. released its own Android app this week for OpenClaw, which helps users shop online and book travel, among other things.  From Tencent Holdings Ltd. to Minimax Group Inc., China’s biggest AI players are competing to offer OpenClaw services — feeding a nationwide frenzy dubbed “raising lobsters.”",2026-03-13 23:57:21,4.21875,0.9,0.75,0.45,0.8,2026-03-14 00:02:48,2026-03-13
小米集团-W,1810.HK,2026-03-12 19:26:15,Tesla China Deliveries Jump 91% in February Despite Weak Auto Market,"China Passenger Car Association data shows Tesla delivered 58,599 vehicles as overall car and EV sales declined sharply.",2026-03-13 06:21:59,0.0,0.2,0.15,0.0,0.0,2026-03-13 06:22:36,2026-03-12
比亚迪股份,1211.HK,2026-03-12 19:26:15,Tesla China Deliveries Jump 91% in February Despite Weak Auto Market,"China Passenger Car Association data shows Tesla delivered 58,599 vehicles as overall car and EV sales declined sharply.",2026-03-13 06:21:59,0.0699999999999999,0.4,0.35,0.2,-0.1,2026-03-13 06:22:40,2026-03-12
比亚迪股份,1211.HK,2026-03-12 18:23:45,Tesla (TSLA) Sees UK Sales Drop 45% in February,"Tesla Inc. (NASDAQ:TSLA) is among the 11 best robotics stocks to buy right now. On March 4, data from the transport research firm New Automotive indicated that U.K. sales of Tesla Inc. (NASDAQ:TSLA) fell sharply in February. The organization noted that Tesla Inc. (NASDAQ:TSLA) sold 2,208 vehicles in February, down 45.2% from a year earlier. […]",2026-03-13 06:21:59,0.63,0.45,0.35,0.2,0.6,2026-03-13 06:22:44,2026-03-12
阿里巴巴-SW,9988.HK,2026-03-12 18:14:21,A Look At Alibaba Group Holding’s (NYSE:BABA) Valuation After Mixed Recent Share Price Performance,"Alibaba’s recent performance in focus Alibaba Group Holding (NYSE:BABA) has been on investors’ radar after a mixed stretch in the stock, with the most recent month showing a 16.4% decline and the past 3 months reflecting a 13.1% decline. See our latest analysis for Alibaba Group Holding. Alibaba’s recent performance shows a mixed picture: a 16.4% decline in the latest 30-day share price return and a 12.5% decline year to date suggest waning momentum, while a 1.0% total shareholder return over...",2026-03-13 06:21:59,-3.4912499999999995,0.95,0.7,-0.4,-0.65,2026-03-13 06:22:48,2026-03-12
友邦保险,1299.HK,2026-03-12 17:13:24,Assessing AIA Group (SEHK:1299) Valuation After Mixed Short Term Returns And Stronger Long Term Momentum,"AIA Group (SEHK:1299) has been drawing investor attention after recent share price moves, with the stock showing mixed short term returns but a stronger picture over the past year and the past 3 months. See our latest analysis for AIA Group. After a softer patch in the last month, with a 30 day share price return of a 1.8% decline and a recent 1 day pullback, AIA Group still shows stronger momentum when viewed over a longer period, reflected in a 90 day share price return of 6.77% and a 1...",2026-03-13 06:21:59,1.816875,0.95,0.45,0.25,0.6,2026-03-13 06:22:52,2026-03-12
阿里巴巴-SW,9988.HK,2026-03-12 16:31:04,Kadensa Capital Liquidates Stride Position Amid Stock's 50% Plummet,"Stride delivers digital curriculum and workforce training to schools, employers, and individual learners across the education sector.",2026-03-13 06:21:59,0.0,0.1,0.05,0.0,0.0,2026-03-13 06:22:55,2026-03-12
腾讯控股,0700.HK,2026-03-12 16:15:16,Why ByteDance’s Reported Data Center Order Could Be a Major Win for VNET (VNET),"VNET Group, Inc (NASDAQ:VNET) is one of the best rising AI stocks to buy now. On March 5, 2026, The Star, citing Bloomberg, reported that VNET had secured a record order from ByteDance to provide about 500 megawatts of data center capacity in China. According to the report, ByteDance is seeking more computing and storage […]",2026-03-13 06:21:59,0.0,0.1,0.05,0.0,0.0,2026-03-13 06:22:59,2026-03-12
阿里巴巴-SW,9988.HK,2026-03-12 16:15:16,Why ByteDance’s Reported Data Center Order Could Be a Major Win for VNET (VNET),"VNET Group, Inc (NASDAQ:VNET) is one of the best rising AI stocks to buy now. On March 5, 2026, The Star, citing Bloomberg, reported that VNET had secured a record order from ByteDance to provide about 500 megawatts of data center capacity in China. According to the report, ByteDance is seeking more computing and storage […]",2026-03-13 06:21:59,0.0,0.1,0.05,0.0,0.0,2026-03-13 06:23:03,2026-03-12
比亚迪股份,1211.HK,2026-03-12 15:40:01,VWAGY or BYDDY: Which Is the Better Value Stock Right Now?,VWAGY vs. BYDDY: Which Stock Is the Better Value Option?,2026-03-13 06:21:59,0.0,0.7,0.4,0.0,0.0,2026-03-13 06:23:07,2026-03-12
小米集团-W,1810.HK,2026-03-12 13:54:16,Tesla China Sales Show It Isn't Struggling As Much As Its Rivals,"In February, Tesla retail sales rose 42%, while the rest of the EV market contracted 32%, according to newly released data.",2026-03-13 06:21:59,0.0,0.2,0.1,0.0,0.0,2026-03-13 06:23:11,2026-03-12
汇丰银行,0005.HK,2026-03-12 13:19:11,Iran war leads to UK mortgage rate rises,"Find out the latest mortgage rates and deals from HSBC, NatWest, Santander, Barclays and more",2026-03-13 06:21:59,0.0,0.2,0.1,0.0,0.0,2026-03-13 06:23:15,2026-03-12
腾讯控股,0700.HK,2026-03-12 12:05:00,Foreign Stocks Are Reeling From the Iran War. It’s Time to Buy the Dip.,"The energy shock has hit markets in Europe and Asia, but their growth drivers are intact. Where to find bargains.",2026-03-13 06:21:59,0.05,0.1,0.2,0.1,0.4,2026-03-13 06:23:18,2026-03-12
腾讯控股,0700.HK,2026-03-12 11:20:23,Morgan Stanley says this China name is ’a global AI winner’,"Investing.com -- Companies capable of building and integrating the full AI stack — chips, cloud infrastructure, models and applications — are best positioned to capture long-term value from the technology, according to Morgan Stanley.",2026-03-13 06:21:59,3.92,0.8,0.7,0.5,0.9,2026-03-13 06:23:22,2026-03-12
阿里巴巴-SW,9988.HK,2026-03-11 22:01:11,"Alibaba Expands Qwen AI Push, Rejects 'Collective Resignation' Claims","Alibaba Group Holding Limited is reshaping its artificial intelligence strategy by restructuring leadership, recruiting new talent, and accelerating the development of its Qwen large language model amid intensifying competition in China’s AI market. Leadership Changes And New AI Hiring Alibaba is reshuffling leadership and increasing resources around its Qwen large language model after a key technical leader departed, amid intensifying competition among China’s major technology companies in the",2026-03-12 06:23:59,3.740625,0.95,0.75,0.4,0.65,2026-03-12 06:24:35,2026-03-11
汇丰银行,0005.HK,2026-03-11 21:16:23,HSBC Balances Net Zero Financing Push With Renewed Gulf Growth Focus,"HSBC Holdings has appointed Denise Odaro as head of sustainable finance for Europe and the Americas, focusing on climate related financing and transition support for clients. The bank has also reiterated its commitment to Gulf Cooperation Council economies, with the CEO expressing confidence in regional growth prospects despite recent tensions. For investors tracking HSBC Holdings (LSE:HSBA), these moves come with the shares trading around £12.728 and a very large 5 year return, alongside a...",2026-03-12 06:23:59,3.7800000000000007,0.9,0.7,0.4,0.8,2026-03-12 06:24:39,2026-03-11
汇丰银行,0005.HK,2026-03-11 19:48:31,HSBC Exec Discusses 2025 Annual Venture Healthcare Report Findings,"Jonathan Norris, Managing Director of HSBC Innovation, joins Ashley Mastronardi on NYSE Floor Talk",2026-03-12 06:23:59,0.04,0.4,0.2,0.0,0.1,2026-03-12 06:24:42,2026-03-11
比亚迪股份,1211.HK,2026-03-11 18:24:37,China Auto Deliveries Drop 15% as Exports Jump 52%,China vehicle sales fell to about 1.8 million in February while exports surged and EV deliveries declined 14%.,2026-03-12 06:23:59,2.975,0.85,0.7,0.4,0.6,2026-03-12 06:24:46,2026-03-11
友邦保险,1299.HK,2026-03-11 16:52:00,4 Stocks to Add to Your Portfolio From a Prospering Life Insurance Industry,"Redesigning and repricing of products and services amid a low rate environment are likely to help Zacks Life Insurance industry players like AAGIY, MFC, SLF and RGA. These companies are investing heavily in digitization.",2026-03-12 06:23:59,2.2,0.8,0.5,0.4,0.7,2026-03-12 06:24:50,2026-03-11
比亚迪股份,1211.HK,2026-03-11 14:08:12,Chinese EV Brands Look For Dealers To Import Cars To Canada. Tesla Does This.,"Tesla will face competition from Chinese EVs in Canada, now that a 100% tariff keeping them out of the country was lowered to 6.1%.",2026-03-12 06:23:59,2.6812500000000004,0.75,0.65,0.4,0.7,2026-03-12 06:24:54,2026-03-11
腾讯控股,0700.HK,2026-03-11 13:26:00,Tencent (TCEHY) Surges 10.4%: Is This an Indication of Further Gains?,Tencent (TCEHY) saw its shares surge in the last session with trading volume being higher than average. The latest trend in earnings estimate revisions may not translate into further price increase in the near term.,2026-03-12 06:23:59,3.325,0.95,0.7,0.4,0.6,2026-03-12 06:24:57,2026-03-11
阿里巴巴-SW,9988.HK,2026-03-11 13:00:07,Is Trending Stock Alibaba Group Holding Limited (BABA) a Buy Now?,"Recently, Zacks.com users have been paying close attention to Alibaba (BABA). This makes it worthwhile to examine what the stock has in store.",2026-03-12 06:23:59,0.09,0.9,0.2,0.0,0.1,2026-03-12 06:25:01,2026-03-11
汇丰银行,0005.HK,2026-03-11 12:48:03,Average UK mortgage rate tops 5% as lenders scurry to reprice loans amid Middle East crisis,More than 500 lending products pulled in biggest single upheaval since Liz Truss’s mini-budget in 2022,2026-03-12 06:23:59,-0.2437499999999999,0.75,0.65,0.4,-0.5,2026-03-12 06:25:05,2026-03-11
新鸿基地产,0016.HK,2026-03-11 07:33:00,Best Income Stocks to Buy for March 11th,"PHG, SUHJY and JPM made it to the Zacks Rank #1 (Strong Buy) income stocks list on March 11th, 2026.",2026-03-12 06:23:59,0.0,0.0,0.0,0.0,0.0,2026-03-12 06:25:09,2026-03-11
腾讯控股,0700.HK,2026-03-11 06:33:00,"China’s OpenClaw Craze Buoys Tech Stocks, Fuels AI Pivot","The open-source AI assistant can make and carry out decisions on the user’s behalf, and has become a hit in China’s tech community.",2026-03-12 06:23:59,0.7,0.4,0.35,0.4,0.6,2026-03-12 06:25:12,2026-03-11
阿里巴巴-SW,9988.HK,2026-03-11 02:13:08,Does Alibaba Group Holding (NYSE:BABA) Offer Value After Recent Share Price Pullback?,"If you are wondering whether Alibaba Group Holding is priced attractively today, the key question is whether the current share price reflects what the business could be worth in the long run. The stock last closed at US$136.85, with returns of 0.9% over 7 days, a 15.8% decline over 30 days, a 12.1% decline year to date, a 0.1% gain over 1 year and a 71.7% gain over 3 years, while the 5 year return stands at a 36.5% decline. Recent coverage of Alibaba has continued to focus on its role as a...",2026-03-12 06:23:59,0.6075000000000002,0.9,0.45,0.1,0.2,2026-03-12 06:25:16,2026-03-11
比亚迪股份,1211.HK,2026-03-11 01:31:24,BYD Needs Just 9 Minutes To Challenge Tesla's Last Great Advantage,"One of Tesla Inc's biggest competitive advantages has never been the cars. It's the chargers. For years, Tesla's Supercharger network has set the benchmark for EV infrastructure, enabling drivers to recharge quickly and travel long distances with minimal planning. For many EV buyers, that charging network remains Tesla's biggest practical advantage over a growing wave of Chinese EV rivals. But Chinese EV giant BYD Co., Ltd. may be testing the limits of that advantage. The company has unveiled a",2026-03-12 06:23:59,5.0,0.9,0.85,0.7,0.8,2026-03-12 06:25:19,2026-03-11
腾讯控股,0700.HK,2026-03-11 00:57:43,"SoftBank's PayPay plans to price US IPO around low end of range, sources say","The initial public offering of SoftBank's PayPay is likely to price around the low end of ‌its marketing range as war in the Middle East roils markets, two people ‌familiar with the matter said.  Tencent, Ant Group's Alipay, and Alphabet's Google have committed to invest in the IPO, one of the people said.  PayPay has played a central role in encouraging Japanese consumers to move away from a preference for cash by offering rebates on its payments app.",2026-03-12 06:23:59,0.42,0.4,0.35,0.2,0.4,2026-03-12 06:25:23,2026-03-11
腾讯控股,0700.HK,2026-03-10 22:12:32,Tencent’s OpenClaw AI Push Deepens Ties With Undervalued Shares,"Tencent Holdings (SEHK:700) has rolled out WorkBuddy, a workplace AI agent built on the OpenClaw framework. The company is offering free OpenClaw cloud installations, which has attracted strong demand and long sign up queues. Municipal authorities in several Chinese tech hubs are backing OpenClaw related initiatives that lean on Tencent's infrastructure and support. Tencent is positioning itself as a central player in the development of China's OpenClaw based AI ecosystem for business and...",2026-03-11 06:25:05,5.0,0.95,0.8,0.65,0.9,2026-03-11 06:25:42,2026-03-10
阿里巴巴-SW,9988.HK,2026-03-10 20:46:04,Meituan Doubles Down on Gulf Expansion as Iran Conflict and Brazil Setback Loom,China's food-delivery giant faces Middle East risks while Brazil expansion stalls and domestic competition intensifies.,2026-03-11 06:25:05,-0.15,0.2,0.15,-0.4,-0.6,2026-03-11 06:25:47,2026-03-10
比亚迪股份,1211.HK,2026-03-10 20:45:08,China Hongqiao Surges 585% as Aluminum Boom Lifts Zhang Bo's $48 Billion Fortune,Rising aluminum demand and supply disruptions help propel Hongqiao's stock surge and elevate Zhang Bo as Asia's richest metals tycoon.,2026-03-11 06:25:05,0.03,0.2,0.15,0.0,0.2,2026-03-11 06:25:52,2026-03-10
小米集团-W,1810.HK,2026-03-10 20:45:08,China Hongqiao Surges 585% as Aluminum Boom Lifts Zhang Bo's $48 Billion Fortune,Rising aluminum demand and supply disruptions help propel Hongqiao's stock surge and elevate Zhang Bo as Asia's richest metals tycoon.,2026-03-11 06:25:05,0.0,0.1,0.05,0.0,0.0,2026-03-11 06:25:56,2026-03-10
阿里巴巴-SW,9988.HK,2026-03-10 18:38:23,"NetEase, Inc. (NTES): Analyst Confidence and Growth Ahead","NetEase, Inc. (NASDAQ:NTES) is one of the 11 Best Affordable Growth Stocks to Buy Now. On March 2, Morgan Stanley reiterated an Overweight rating on NetEase, Inc. (NASDAQ:NTES) and a $154 price target. The positive stance follows receipt of a migration exchange notice from the Hong Kong Exchange, requiring the company to convert its secondary […]",2026-03-11 06:25:05,0.0,0.1,0.05,0.0,0.0,2026-03-11 06:25:59,2026-03-10
比亚迪股份,1211.HK,2026-03-10 18:09:21,Report: China's BYD Exploring Formula One Team To Boost Global Profile,An Formula One team could help the BYD boost its international profile as it competes with Tesla and Chinese rivals in the global electric vehicle market.,2026-03-11 06:25:05,4.14375,0.85,0.65,0.7,0.8,2026-03-11 06:26:03,2026-03-10
阿里巴巴-SW,9988.HK,2026-03-10 17:27:08,"Dear Alibaba Stock Fans, Mark Your Calendars for March 19",Investors should closely watch Alibaba Group as the e-commerce and cloud giant prepares to report its third quarter results on Mar. 19.,2026-03-11 06:25:05,0.0,1.0,0.55,0.0,0.0,2026-03-11 06:26:07,2026-03-10
汇丰银行,0005.HK,2026-03-10 15:07:30,‘Golden window’ to stash money into Isas opens as providers improve deals,HSBC UK is offering up to £500 cashback for depositing and/or transferring new funds into a cash Isa before May 11.,2026-03-11 06:25:05,1.785,0.85,0.4,0.35,0.7,2026-03-11 06:26:12,2026-03-10
腾讯控股,0700.HK,2026-03-10 14:31:15,Tencent Jumps 6.2% as OpenClaw AI Frenzy Lifts Chinese Tech Shares,"WorkBuddy launch and rising OpenClaw adoption push Tencent, Zhipu, and MiniMax higher as China's AI-agent momentum accelerates.",2026-03-11 06:25:05,5.0,0.9,0.85,0.6,0.9,2026-03-11 06:26:16,2026-03-10
小米集团-W,1810.HK,2026-03-10 13:36:00,Kingsoft Cloud (KC) Surges 19.0%: Is This an Indication of Further Gains?,Kingsoft Cloud (KC) witnessed a jump in share price last session on above-average trading volume. The latest trend in earnings estimate revisions for the stock doesn't suggest further strength down the road.,2026-03-11 06:25:05,-0.06,0.2,0.1,-0.4,-0.2,2026-03-11 06:26:20,2026-03-10
友邦保险,1299.HK,2026-03-10 12:43:00,Futu Holdings Gears Up to Report Q4 Earnings: What's in the Cards?,"FUTU heads into Q4 earnings with strong client inflows, an active HK IPO pipeline and expanding crypto trading expected to support volumes.",2026-03-11 06:25:05,0.0,0.1,0.05,0.0,0.0,2026-03-11 06:26:24,2026-03-10
汇丰银行,0005.HK,2026-03-10 11:54:17,HSBC CEO confident in Gulf amid Middle East tensions – report,These remarks are among the first made by a global banking executive since the escalation of hostilities in the region.,2026-03-11 06:25:05,2.2,0.8,0.5,0.4,0.7,2026-03-11 06:26:28,2026-03-10
比亚迪股份,1211.HK,2026-03-10 11:31:39,"Tesla, Inc. (TSLA) UK Car Sales Fall 37% Amid Heightening Chinese Competition, Reuters Reports","Tesla, Inc. (NASDAQ:TSLA) is one of the top stocks that will make you rich in 10 years. On March 5, Reuters reported that Tesla, Inc.’s (NASDAQ:TSLA) UK sales dropped 37% in February compared to the prior year, according to data from the Society of Motor Manufacturers and ​Traders (SMMT). The statistics showed that sales dropped […]",2026-03-11 06:25:05,2.9250000000000007,0.75,0.65,0.4,0.8,2026-03-11 06:26:32,2026-03-10
中芯国际,0981.HK,2026-03-10 11:00:20,China's Semiconductor Makers Unite In Call To 'Build China's ASML',"China’s leading semiconductor executives are calling for a nationwide effort to create a homegrown alternative to ASML Holding N.V. as U.S. restrictions tighten on advanced chip tools. Call For Domestic EUV Ecosystem In an article published in Science and Technology Review, executives from Semiconductor Manufacturing International Corporation (SMIC), Empyrean, Yangtze Memory Technologies (YMTC), and Naura Technology, along with academics, argued that China’s chip sector remains too small, fragme",2026-03-11 06:25:05,5.0,0.9,0.85,0.6,0.75,2026-03-11 06:26:36,2026-03-10
腾讯控股,0700.HK,2026-03-10 09:25:00,"China’s OpenClaw Craze Buoys Tech Stocks, Fuels AI Pivot","The open-source AI assistant can make and carry out decisions on the user’s behalf, and has become a hit in China’s tech community.",2026-03-11 06:25:05,0.7,0.4,0.35,0.4,0.6,2026-03-11 06:26:41,2026-03-10
阿里巴巴-SW,9988.HK,2026-03-09 21:22:04,"Stock Market Today, March 9: Amazon Edges Higher on Zoox Robotaxi Expansion","Zoox's robotaxi rollout and delivery network spotlight Amazon’s evolving logistics and AI strategy, today, March 9, 2026.",2026-03-10 06:25:12,0.0,0.1,0.05,0.0,0.0,2026-03-10 06:25:49,2026-03-09
比亚迪股份,1211.HK,2026-03-09 20:02:56,Lucid (LCID) and Rivian (RIVN) Stocks Jump as Oil Rises but Tesla (TSLA) Stock Lags,"Lucid Group (NASDAQ:LCID) stock and Rivian Automotive (NASDAQ:RIVN) stock are jumping sharply today while Tesla (NASDAQ:TSLA) lags behind. Tesla shares are weighed down by a new federal probe into its Full Self-Driving (FSD) system and intensifying competition from Chinese electric vehicle (EV) manufacturer BYD (OTC:BYDDY). Tesla stock is down 11.23% year-to-date in 2026, while Rivian ... Lucid (LCID) and Rivian (RIVN) Stocks Jump as Oil Rises but Tesla (TSLA) Stock Lags",2026-03-10 06:25:12,2.8,0.8,0.7,0.4,0.6,2026-03-10 06:25:52,2026-03-09
腾讯控股,0700.HK,2026-03-09 19:56:00,Sector Update: Consumer Stocks Rise Late Afternoon,"Consumer stocks were higher late Monday afternoon, with the State Street Consumer Staples Select Sec",2026-03-10 06:25:12,0.02,0.2,0.1,0.0,0.2,2026-03-10 06:25:56,2026-03-09
比亚迪股份,1211.HK,2026-03-09 19:02:41,BYD Files Paperwork To Import EVs To Canada. Tesla Does This.,"Tesla will face competition from Chinese EVs in Canada, now that a 100% tariff keeping them out of the country was lowered to 6.1%.",2026-03-10 06:25:12,3.71875,0.85,0.7,0.45,0.8,2026-03-10 06:26:00,2026-03-09
腾讯控股,0700.HK,2026-03-09 18:41:57,Top Midday Decliners,Warner Bros. Discovery (WBD) is the target of a $110 billion acquisition by Paramount Skydance (PSKY,2026-03-10 06:25:12,0.0,0.1,0.05,0.0,0.0,2026-03-10 06:26:03,2026-03-09
腾讯控股,0700.HK,2026-03-09 16:55:06,EEM: What Every Investor Should Know Before Betting on Emerging Markets in 2026,"EEM is up over the past 12 months, then dropped 8.41% in a single week ending March 6, 2026. That kind of whipsaw is not a glitch in the fund — it is exactly how emerging market exposure behaves when macro sentiment shifts. iShares MSCI Emerging Markets ETF (NYSEARCA:EEM) gives investors broad access to that ... EEM: What Every Investor Should Know Before Betting on Emerging Markets in 2026",2026-03-10 06:25:12,0.0,0.2,0.15,0.0,0.0,2026-03-10 06:26:06,2026-03-09
阿里巴巴-SW,9988.HK,2026-03-09 16:40:00,‘Big Short’ investor Michael Burry made a million-dollar bet on gold and won. Will the gold rush continue in 2026?,A bullish bet on a safe haven asset.,2026-03-10 06:25:12,0.0,0.1,0.05,0.0,0.0,2026-03-10 06:26:10,2026-03-09
阿里巴巴-SW,9988.HK,2026-03-09 16:19:40,Cathie Wood Loads E-Commerce Stocks While Cutting Chip Giant TSMC,"Cathie Wood Adds Amazon, Shopify: Scales Back TSMC Exposure",2026-03-10 06:25:12,0.42,0.4,0.35,0.2,0.4,2026-03-10 06:26:14,2026-03-09
汇丰银行,0005.HK,2026-03-09 15:39:00,Barclays Stock Dips 14.1% YTD: Is It a Buy After the Recent Pullback?,"BCS stock has fallen 14.1% YTD amid volatility, but restructuring moves, acquisitions and plans to return 15B pounds to shareholders could support long-term growth.",2026-03-10 06:25:12,0.0,0.2,0.1,0.0,0.0,2026-03-10 06:26:17,2026-03-09
比亚迪股份,1211.HK,2026-03-09 14:31:42,5 Companies Quietly Eating Tesla’s Lunch in 2026 — and One Is Already Winning,"For the better part of the last decade, Tesla (NASDAQ:TSLA) has been the undisputed king of the EV market with the technology, brand, charging network, and effectively no other competition worth naming. This era is now mostly over as the company posted its second consecutive year of declining deliveries in 2025, down roughly 9% to ... 5 Companies Quietly Eating Tesla’s Lunch in 2026 — and One Is Already Winning",2026-03-10 06:25:12,4.3500000000000005,0.8,0.75,0.6,0.85,2026-03-10 06:26:21,2026-03-09
小米集团-W,1810.HK,2026-03-09 14:31:42,5 Companies Quietly Eating Tesla’s Lunch in 2026 — and One Is Already Winning,"For the better part of the last decade, Tesla (NASDAQ:TSLA) has been the undisputed king of the EV market with the technology, brand, charging network, and effectively no other competition worth naming. This era is now mostly over as the company posted its second consecutive year of declining deliveries in 2025, down roughly 9% to ... 5 Companies Quietly Eating Tesla’s Lunch in 2026 — and One Is Already Winning",2026-03-10 06:25:12,0.0,0.2,0.1,0.0,0.0,2026-03-10 06:26:24,2026-03-09
汇丰银行,0005.HK,2026-03-09 13:56:00,Luxury’s comeback? Why one leading bank thinks the sector is about to rebound,"After two years of disappointing growth, a new report from HSBC argues that luxury’s slowdown is ending. The surprising driver is not just China. It is the US consumer, wealth effects from stock markets, and a long-overdue reset in pricing and creativity. Luxury has had a rough couple of...",2026-03-10 06:25:12,0.7,0.4,0.35,0.4,0.6,2026-03-10 06:26:28,2026-03-09
友邦保险,1299.HK,2026-03-09 13:40:03,Are Finance Stocks Lagging  AIA (AAGIY) This Year?,Here is how AIA (AAGIY) and Bank of Montreal (BMO) have performed compared to their sector so far this year.,2026-03-10 06:25:12,0.0,0.4,0.2,0.0,0.0,2026-03-10 06:26:31,2026-03-09
汇丰银行,0005.HK,2026-03-09 12:46:49,"HSBC hires sustainable finance veteran to lead transition in Europe, Americas",The British bank has appointed Denise Odaro to help clients in the region decarbonize and accelerate the transition to clean energy.,2026-03-10 06:25:12,2.12625,0.9,0.45,0.35,0.7,2026-03-10 06:26:35,2026-03-09
中芯国际,0981.HK,2026-03-09 11:08:05,Assessing Semiconductor Manufacturing International’s Valuation After Recent Share Price Weakness,"Why Semiconductor Manufacturing International is on investors’ radar Semiconductor Manufacturing International (SEHK:981) has caught investor attention after recent share price weakness, with the stock showing declines over the past week, month, and past 3 months despite a positive 1 year total return. This contrast between shorter term pullbacks and longer term gains is prompting some investors to reassess how the current HK$60.85 share price lines up with the company’s reported revenue of...",2026-03-10 06:25:12,-1.0806249999999995,0.95,0.65,-0.2,-0.15,2026-03-10 06:26:39,2026-03-09
