股票名称,股票代码,新闻时间,新闻标题,简要内容,查询时间,情感分数,相关性,影响度,预期差,情感方向,情感分析时间,日期
阿里巴巴-SW,9988.HK,2026-03-22 21:52:00,Alibaba Headcount Falls After Sun Art Exit In 2025 (UPDATED),"Editor’s note: This article has been updated for clarity around Alibaba Group’s workforce changes. While the company has been shifting focus toward AI, the year-over-year decline in headcount was largely driven by the sale of Sun Art, as disclosed in company filings. Additional context has been included. Alibaba Group Holding Limited’s workforce shrank by roughly 34% over the course of 2025, as the company offloaded parts of its offline retail portfolio while sharpening its focus on artificial i",2026-03-23 06:21:57,3.5624999999999996,0.95,0.75,0.4,0.6,2026-03-23 06:22:33,2026-03-22
腾讯控股,0700.HK,2026-03-22 19:04:44,Tencent’s ClawBot Links WeChat And OpenClaw In AI Agent Push,"Tencent Holdings (SEHK:700) has launched ClawBot, connecting its WeChat platform with the OpenClaw AI agent. The rollout marks a new step in Tencent's push into AI agents within China's fast developing AI agent market. ClawBot is designed to deepen AI powered services inside WeChat for both consumers and businesses. Tencent Holdings, trading at around HK$508.0, is moving forward with a fresh AI initiative at a time when its share price is down 18.5% year to date. The launch of ClawBot...",2026-03-23 06:21:57,4.453124999999999,0.95,0.75,0.45,0.8,2026-03-23 06:22:36,2026-03-22
阿里巴巴-SW,9988.HK,2026-03-22 10:23:41,Beijing vows broader market access as goods trade surplus hits record levels,"Investing.com -- People’s Bank of China Governor Pan Gongsheng has issued a firm defense of the nation’s ballooning trade surplus, characterized as a stabilizing force for global financial markets.",2026-03-23 06:21:57,0.125,0.25,0.2,0.1,0.4,2026-03-23 06:22:40,2026-03-22
腾讯控股,0700.HK,2026-03-22 07:36:40,Tencent integrates WeChat with OpenClaw AI agent amid China tech battle,"Tencent launched a tool on ‌Sunday to integrate its WeChat messaging platform with ‌the OpenClaw agent, deepening its push into AI agents that have become ​a key battleground among China's technology companies. The software, called ClawBot, will appear as a contact within WeChat, allowing users of China's most popular app with over 1 billion monthly active ‌users to connect ⁠directly with OpenClaw. Users can send and receive commands to interact with the AI agent through ⁠the messaging interface.",2026-03-23 06:21:57,5.0,0.95,0.75,0.6,0.85,2026-03-23 06:22:44,2026-03-22
阿里巴巴-SW,9988.HK,2026-03-22 00:25:00,Prediction: 2 Things That Will Happen to Alibaba in 2026,"Alibaba's e-commerce empire may no longer be the company's biggest growth story. Instead, artificial intelligence and cloud infrastructure are quickly taking center stage.",2026-03-23 06:21:57,3.2725,0.85,0.7,0.45,0.65,2026-03-23 06:22:48,2026-03-22
汇丰银行,0005.HK,2026-03-21 17:04:19,Sun Life Weighs HSBC Singapore Deal As Valuation Signal Draws Attention,"Sun Life Financial (TSX:SLF) is reportedly exploring a bid for HSBC's Singapore insurance unit. The potential transaction would place Sun Life in competition with other large global insurers interested in the asset. The deal, if pursued and completed, would expand Sun Life's footprint in Singapore's life and health insurance market. For readers following TSX:SLF, this development sits squarely in the core of Sun Life's business focus on insurance and wealth solutions. Large insurers have...",2026-03-23 06:21:57,2.8,0.8,0.7,0.4,0.6,2026-03-23 06:22:52,2026-03-21
小米集团-W,1810.HK,2026-03-21 17:03:50,Assessing Xiaomi (SEHK:1810) Valuation After Recent Share Price Weakness,"Xiaomi shares triggered by recent performance Xiaomi (SEHK:1810) has been drawing attention after a stretch of weaker share performance, with the stock showing negative returns over the past month, past 3 months and year, despite positive annual revenue and net income growth. See our latest analysis for Xiaomi. At the latest share price of HK$33.2, Xiaomi’s recent 8.59% one-day share price decline and 9.44% 30-day share price decline contrast with a much stronger 3-year total shareholder...",2026-03-23 06:21:57,-3.375,1.0,0.75,-0.4,-0.5,2026-03-23 06:22:56,2026-03-21
比亚迪股份,1211.HK,2026-03-21 16:07:06,BYD Expands Brazil Footprint As Investors Weigh Valuation And Growth Potential,"BYD (SEHK:1211) is expanding in Brazil with a new Automotive Testing and Evaluation Center and production growth. The company plans to add a second shift at its Brazilian assembly plant, targeting higher vehicle output and additional jobs. This investment deepens BYD's manufacturing presence in Brazil as part of its wider electric mobility plans. BYD, trading at around HK$103.8, is adding fresh detail to its global manufacturing footprint with this Brazil investment. The move comes after a...",2026-03-23 06:21:57,4.453124999999999,0.95,0.75,0.45,0.8,2026-03-23 06:23:00,2026-03-21
腾讯控股,0700.HK,2026-03-21 12:00:02,M&A News: TikTok Owner ByteDance Sells Gaming Unit Moonton to Saudi Arabia for $6B,"TikTok owner ByteDance has reportedly sold its gaming unit Moonton to a Saudi Arabian peer for around $6 billion to fully focus its attention on AI. Mobile Legends Move According to a Bloomberg report, ByteDance has concluded talks to sell Shanghai Moonton Technology, the studio behind the popular mobile game Mobile Legends, to Savvy Games Group. It is understood that Moonton CEO Zhang Yunfan and his management team will remain in place following the acquisition, while employees will benefit fro",2026-03-23 06:21:57,0.0,0.2,0.15,0.0,0.0,2026-03-23 06:23:03,2026-03-21
中芯国际,0981.HK,2026-03-21 10:48:40,Taiwan Semiconductor Manufacturing (TSM) Staring at Chips Production Disruption Amid Iran War,"Taiwan Semiconductor Manufacturing Company Limited (NYSE:TSM) is one of Harvard University’s top AI stock picks. On March 14, Morgan Stanley warned that the closure of the Strait of Hormuz poses significant risks to the global semiconductor supply chain. Consequently, Taiwan Semiconductor Manufacturing Company Limited (NYSE:TSM) could feel the brunt, given that it manufactures 90% of […]",2026-03-23 06:21:57,-0.15000000000000002,0.25,0.4,0.1,-0.4,2026-03-23 06:23:08,2026-03-21
小米集团-W,1810.HK,2026-03-21 10:03:51,Xiaomi Doubles Down On AI And EVs With MiMo-V2-Pro And SU7,"Xiaomi (SEHK:1810) has released its advanced in house AI model, MiMo-V2-Pro, with a public launch that positions the system for broader commercial use across its product portfolio. The company has also announced a facelifted version of its SU7 electric sedan, paired with an immediate mass rollout following strong pre launch interest. Alongside these launches, Xiaomi has committed substantial new funding to AI research and development, highlighting AI as a core focus area. Xiaomi operates...",2026-03-23 06:21:57,5.0,1.0,0.85,0.7,0.9,2026-03-23 06:23:12,2026-03-21
比亚迪股份,1211.HK,2026-03-21 09:05:40,"NVIDIA GTC Keynote: Huang Unveils “AI Factories,” Blackwell-Rubin Roadmap, and $1T Demand View","NVIDIA (NASDAQ:NVDA) founder and CEO Jensen Huang used his GTC keynote to frame the company as a “platform company” built around three core offerings: its CUDA-X software stack, NVIDIA systems, and a newer concept he described as “AI factories.” Huang repeatedly returned to a central theme: ecosyste",2026-03-23 06:21:57,0.015,0.2,0.15,0.0,0.1,2026-03-23 06:23:15,2026-03-21
汇丰银行,0005.HK,2026-03-21 01:39:36,NIO Inc. (NIO) Upgraded to Buy at HSBC as Firm Sees Stronger 2026 Volume and Earnings Outlook,"NIO Inc. (NYSE:NIO) is one of the best Robinhood stocks on this list. TheFly reported on March 13 that HSBC upgraded NIO from Hold to Buy and raised the price target to $6.80 from $4.80. Following its Q4 release, the firm expressed greater confidence in NIO’s 2026 volume growth and earnings trajectory. It stated that […]",2026-03-23 06:21:57,0.04000000000000001,0.2,0.1,0.0,0.4,2026-03-23 06:23:19,2026-03-21
中芯国际,0981.HK,2026-03-20 20:57:25,"Amtech, Nova, Amkor, Semtech, and Micron Shares Are Falling, What You Need To Know",A number of stocks fell in the afternoon session after federal prosecutors charged a Super Micro Computer co-founder with conspiring to smuggle billions of dollars in AI chips to China.,2026-03-23 06:21:57,-0.6000000000000001,0.4,0.5,-0.2,-0.4,2026-03-23 06:23:23,2026-03-20
中芯国际,0981.HK,2026-03-20 20:47:25,"Teradyne and Seagate Stocks Trade Down, What You Need To Know",A number of stocks fell in the afternoon session after federal prosecutors charged a Super Micro Computer co-founder with conspiring to smuggle billions of dollars in AI chips to China.,2026-03-23 06:21:57,-0.6000000000000001,0.4,0.5,-0.2,-0.4,2026-03-23 06:23:27,2026-03-20
汇丰银行,0005.HK,2026-03-20 19:19:00,Arm Holdings Gets a Double Upgrade. Why AI Is a Game Changer for the Chip Stock.,"Arm Holdings  has had a rocky road since going public in 2023 as a chip designer with deep exposure to the global smartphone market.  While that market isn’t doing too hot these days, Arm’s artificial-intelligence business could finally get the stock moving.  HSBC  gave Arm a rare double upgrade, bumping its rating on the stock to Buy from Reduce and more than doubling its price target to $205, from $90, in a research note Friday.",2026-03-23 06:21:57,0.25,0.2,0.25,0.4,0.6,2026-03-23 06:23:31,2026-03-20
中国海洋石油,0883.HK,2026-03-20 19:07:10,SLB Capital Returns Rise As Digital And Offshore Contracts Shape Outlook,"SLB (NYSE:SLB) has announced a significant dividend increase and a multibillion dollar capital return program to shareholders. The company reports that digital and data center revenues have reached new milestones, with digital recurring revenue now above US$1b. SLB OneSubsea secured an integrated multi well subsea contract from CNOOC for the Kaiping 18-1 field in the South China Sea. For investors watching NYSE:SLB, these updates touch on several core parts of the business. SLB is best...",2026-03-23 06:21:57,3.7187499999999996,0.85,0.7,0.45,0.8,2026-03-23 06:23:35,2026-03-20
小米集团-W,1810.HK,2026-03-20 18:01:54,"Pop Mart, Laopu Set for Triple-Digit Growth as China Consumption Slows","Viral demand fades, but gold jewelry and new IP launches may sustain standout growth versus weak broader spending",2026-03-23 06:21:57,0.0,0.2,0.15,0.0,0.0,2026-03-23 06:23:38,2026-03-20
美团-W,3690.HK,2026-03-20 17:31:00,"Alibaba Stock Is Getting Hit Again, but Qwen and Cloud Growth Are Surging","Alibaba took another tumble after its latest earnings report, but its cloud segment continues to impress as it works toward its goal of $100 billion in revenue.",2026-03-23 06:21:57,0.05000000000000001,0.4,0.25,0.0,0.1,2026-03-23 06:23:42,2026-03-20
比亚迪股份,1211.HK,2026-03-20 14:02:07,"Finance week ahead: UK inflation, BYD, Next, Kingfisher and Bellway",Earnings preview of key companies reporting next week and what to look out for.,2026-03-23 06:21:57,0.0,0.8,0.5,0.0,0.0,2026-03-23 06:23:45,2026-03-20
阿里巴巴-SW,9988.HK,2026-03-19 21:39:22,"Stock Market Today, March 19: Brent Crude's $119 Spike Rattles Markets","On March 19, 2026, gold’s slide pulls on Newmont, and oil shocks ripple through an already risk‑averse U.S. market.",2026-03-20 06:24:27,-0.005,0.1,0.05,0.0,-0.2,2026-03-20 06:25:03,2026-03-19
阿里巴巴-SW,9988.HK,2026-03-19 21:29:32,"Alibaba stock falls despite AI outlook, Elliott takes Align stake","Yahoo Finance Markets and Data Editor Jared Blikre and Market Catalysts host Julie Hyman take a closer look at some of Thursday morning's trending tickers and stories. Alibaba (BABA) stock is plunging after the company reported revenue that fell short of expectations, though analysts are still bullish on Alibaba's artificial intelligence (AI) outlook. Elliott Investment Management is building a stake in Invisalign-maker Align Technology (ALGN).",2026-03-20 06:24:27,-5.0,0.9,0.85,-0.7,-0.65,2026-03-20 06:25:07,2026-03-19
阿里巴巴-SW,9988.HK,2026-03-19 20:51:00,"These Stocks Are Today’s Movers: Micron, Accenture, Seagate, APA, Newmont, Alibaba, Swarmer, and More",STOCKSTOWATCHTODAY BLOG  Stocks fell Thursday as strikes on energy infrastructure across the Middle East drove up oil prices and Brent crude briefly soared to nearly $120 a barrel. These stocks made notable moves:  APA climbed 4%.,2026-03-20 06:24:27,0.0,0.1,0.05,0.0,0.0,2026-03-20 06:25:10,2026-03-19
汇丰银行,0005.HK,2026-03-19 20:05:18,How The Microsoft (MSFT) Investment Story Is Shifting With AI Optimism And Caution,"Microsoft’s fair value price target has been nudged from US$595.99 to US$594.62, a small reset that keeps the broader long term story largely intact. Analysts linking this move to AI related capital spending, growth assumptions, and recalibrated expectations describe a more balanced mix of enthusiasm and caution, with some trimming targets while maintaining constructive views. As you read on, you will see how these shifts fit into the evolving Microsoft narrative and what to watch as new...",2026-03-20 06:24:27,0.0,0.1,0.05,0.0,0.0,2026-03-20 06:25:14,2026-03-19
汇丰银行,0005.HK,2026-03-19 19:54:17,"HSBC's 20,000 Job Cuts Signal AI-Driven Cost Reset",Proposed reductions target back-office roles in multi-year restructuring,2026-03-20 06:24:27,4.0375,0.95,0.85,0.4,0.6,2026-03-20 06:25:18,2026-03-19
小米集团-W,1810.HK,2026-03-19 18:37:34,"Xiaomi Links Hunter Alpha to In-House AI, Shares Rise",Hunter Alpha attribution and SU7 launch drive renewed momentum,2026-03-20 06:24:27,5.0,0.95,0.85,0.6,0.9,2026-03-20 06:25:22,2026-03-19
腾讯控股,0700.HK,2026-03-19 18:26:00,"Tencent Q4 Earnings Beat Estimates, Revenues Increase Y/Y","TCEHY beat Q4 earnings as revenues rise 13% y/y, driven by gaming and marketing services, along with margin expansion despite higher expenses.",2026-03-20 06:24:27,5.0,1.0,0.85,0.7,0.9,2026-03-20 06:25:25,2026-03-19
汇丰银行,0005.HK,2026-03-19 18:16:00,"Eli Lilly’s Weight-Loss Drug Candidate Is a Triple Treat. Move Over, Zepbound.",Lilly says its experimental drug retatrutide met the primary endpoint and key secondary endpoints in a new study.,2026-03-20 06:24:27,0.0,0.1,0.05,0.0,0.0,2026-03-20 06:25:29,2026-03-19
地平线机器人,9660.HK,2026-03-19 17:00:50,Horizon Robotics (FRA:8YO) Full Year 2025 Earnings Call Highlights: Record Revenue Growth ...,"Despite a significant revenue increase and market leadership, Horizon Robotics faces challenges with operating losses and competition from industry giants.",2026-03-20 06:24:27,2.0250000000000004,0.9,0.75,0.2,0.4,2026-03-20 06:25:33,2026-03-19
比亚迪股份,1211.HK,2026-03-19 16:14:39,CIBC Confirms Outperformer Rating on Boyd Group Services and Cuts Target to C$280 on Q4 Results,CIBC Capital Markets maintained its outperformer rating on the shares of Boyd Group Services (BYD.TO,2026-03-20 06:24:27,0.0,0.1,0.05,0.0,0.0,2026-03-20 06:25:37,2026-03-19
小米集团-W,1810.HK,2026-03-19 13:01:12,"Xiaomi to invest at least $8.7 billion in AI over next three years, CEO says","Chinese smartphone and electric vehicle giant Xiaomi will invest at least 60 billion yuan ($8.70 billion) in artificial ‌intelligence over the next three years, CEO Lei Jun said on Thursday.  The announcement ‌came a day after the company officially unveiled its new flagship AI model MiMo-V2-Pro, a large language model ​originally uploaded anonymously onto OpenRouter last week.  Lei, speaking at a company event in Beijing, ‌highlighted MiMo-V2-Pro's global reception, saying it ⁠would rapidly improve, and revealed Xiaomi's budget for AI research this year had exceeded the previously announced 16 billion yuan figure.",2026-03-20 06:24:27,5.0,1.0,0.85,0.7,0.9,2026-03-20 06:25:41,2026-03-19
小米集团-W,1810.HK,2026-03-19 12:42:19,Xiaomi Shares Jump 5.8% as AI Model Launch and EV Update Drive Rebound,Stock leads Hang Seng Tech Index after MiMo V2 Pro rollout and ahead of refreshed SU7 EV debut in Beijing,2026-03-20 06:24:27,5.0,1.0,0.9,0.7,0.9,2026-03-20 06:25:48,2026-03-19
腾讯控股,0700.HK,2026-03-19 12:42:19,Xiaomi Shares Jump 5.8% as AI Model Launch and EV Update Drive Rebound,Stock leads Hang Seng Tech Index after MiMo V2 Pro rollout and ahead of refreshed SU7 EV debut in Beijing,2026-03-20 06:24:27,0.0,0.1,0.05,0.0,0.0,2026-03-20 06:25:44,2026-03-19
友邦保险,1299.HK,2026-03-19 07:00:27,AIA Group Ltd (AAGIY) Full Year 2025 Earnings Call Highlights: Record Growth and Strategic ...,"AIA Group Ltd (AAGIY) reports robust financial performance with double-digit growth, a new share buyback, and strategic expansions in key markets.",2026-03-20 06:24:27,5.0,1.0,0.85,0.6,0.9,2026-03-20 06:25:51,2026-03-19
腾讯控股,0700.HK,2026-03-19 03:58:55,"Xiaomi Shares Jump on AI Model Buzz, Upcoming SU7 Model Facelift","The Hong Kong-listed stock jumped as much as 5.8%, making it the best performer on the Hang Seng Tech Index — which itself fell more than 2% after Tencent Holdings Ltd. earnings disappointed investors and as the war in Iran escalated.  Xiaomi has stepped up its AI efforts to catch up to the frenzy around agentic AI tool OpenClaw as interest in China surges.  Earlier this month Xiaomi said it had begun testing of the AI agent miclaw for mobile devices.",2026-03-20 06:24:27,-0.12,0.1,0.2,-0.5,-0.7,2026-03-20 06:25:55,2026-03-19
友邦保险,1299.HK,2026-03-19 03:51:32,AIA's Jones on FY Earnings,"Garth Jones, AIA Group CFO, discusses the insurer's full year results that saw a 17 percent increase in annual new business value, and sees strong momentum in Chinese business growth despite the challenges to Asia's largest economy. He speaks exclusively with Shery Ahn and Haidi Stroud Watts on ""Bloomberg: The Asia Trade"".",2026-03-20 06:24:27,4.56,0.95,0.8,0.45,0.75,2026-03-20 06:25:59,2026-03-19
比亚迪股份,1211.HK,2026-03-18 22:31:13,"Tesla Rivals BYD, Geely To Adopt Nvidia's Self-Driving Tech—Jensen Huang Says 'Everything That Moves' Will Be Autonomous","Nvidia Corp. has revealed that Chinese automakers like BYD Co. Ltd. and Geely Automobile Holdings Ltd. are among the companies incorporating its technology into their self-driving pursuits. Companies To Adopt Drive Hyperion In an official statement released on Monday following the GPU Technology Conference 2026, the chipmaker announced that, in addition to BYD and Geely, Japanese automakers Isuzu and Nissan will also incorporate Nvidia’s technology. Nvidia said in the statement that the automake",2026-03-20 06:24:27,4.21875,0.9,0.75,0.45,0.8,2026-03-20 06:26:03,2026-03-18
阿里巴巴-SW,9988.HK,2026-03-18 21:06:58,How Investors Are Reacting To Alibaba Group Holding (BABA) AI Reorganization And Cloud Price Increases,"Earlier in March 2026, Alibaba Group Holding consolidated its artificial intelligence activities into a new Alibaba Token Hub unit under CEO Eddie Wu, while also lifting prices on its T-Head AI chips by up to the mid-30% range and raising cloud storage fees by about 30%. This combination of reorganization and price hikes, alongside the launch of the Wukong enterprise AI platform, signals a clearer push to turn Alibaba’s AI and cloud capabilities into higher-margin, revenue-generating...",2026-03-19 06:29:33,4.887499999999999,1.0,0.85,0.45,0.7,2026-03-19 06:30:09,2026-03-18
阿里巴巴-SW,9988.HK,2026-03-18 19:53:37,Alibaba Group Holding Limited (BABA)’s Expanding Role in AI and Digital Innovation,"Alibaba Group Holding Limited (NYSE:BABA) is one of the best metaverse stocks to buy, according to analysts. On March 12, Morgan Stanley said companies that control the full AI stack — chips, cloud systems, models, and applications, will be the strongest in the long run. The analysts highlighted Alibaba Group Holding Limited (NYSE:BABA) as their […]",2026-03-19 06:29:33,4.050000000000001,0.9,0.75,0.4,0.8,2026-03-19 06:30:13,2026-03-18
腾讯控股,0700.HK,2026-03-18 19:53:37,Alibaba Group Holding Limited (BABA)’s Expanding Role in AI and Digital Innovation,"Alibaba Group Holding Limited (NYSE:BABA) is one of the best metaverse stocks to buy, according to analysts. On March 12, Morgan Stanley said companies that control the full AI stack — chips, cloud systems, models, and applications, will be the strongest in the long run. The analysts highlighted Alibaba Group Holding Limited (NYSE:BABA) as their […]",2026-03-19 06:29:33,0.0,0.2,0.1,0.0,0.0,2026-03-19 06:30:16,2026-03-18
腾讯控股,0700.HK,2026-03-18 19:01:36,Tencent Holdings Ltd (TCEHY) Q4 2025 Earnings Call Highlights: Strong Revenue Growth and AI ...,"Tencent Holdings Ltd (TCEHY) reports a 13% revenue increase and strategic AI advancements, despite rising expenses and competitive challenges.",2026-03-19 06:29:33,4.8,1.0,0.8,0.5,0.7,2026-03-19 06:30:20,2026-03-18
腾讯控股,0700.HK,2026-03-18 18:00:58,Tencent Shares Rise 4.7% as AI Agent Push Challenges Alibaba,"Tencent rolls out QClaw, WorkBuddy and plans WeChat integration, adding about $30 billion in value as investors reassess China's AI race.",2026-03-19 06:29:33,5.0,1.0,0.9,0.7,0.9,2026-03-19 06:30:27,2026-03-18
阿里巴巴-SW,9988.HK,2026-03-18 18:00:58,Tencent Shares Rise 4.7% as AI Agent Push Challenges Alibaba,"Tencent rolls out QClaw, WorkBuddy and plans WeChat integration, adding about $30 billion in value as investors reassess China's AI race.",2026-03-19 06:29:33,-3.0000000000000004,0.8,0.75,-0.4,-0.6,2026-03-19 06:30:23,2026-03-18
小米集团-W,1810.HK,2026-03-18 15:35:22,China's EV Slump 'Largely Behind Us.' Two Tesla Rivals Do This.,"Tesla's Chinese competitors Xiaomi and XPeng prepare two major investor updates this week. Their shares are down, but Tesla stock is up slightly this week.",2026-03-19 06:29:33,2.52,0.8,0.7,0.4,0.5,2026-03-19 06:30:31,2026-03-18
比亚迪股份,1211.HK,2026-03-18 11:43:28,JD.com (JD) and BYD Enters a Strategic Partnership,"JD.com, Inc. (NASDAQ:JD) is one of the Cheap Stocks to Buy for High Returns in 2026. On March 13, Reuters reported that JD.com, Inc. (NASDAQ:JD) and BYD have formed a strategic partnership on building and expanding fast charging electric vehicle stations. ​Both companies have already launched the first jointly developed charging station at Shenzhen. The […]",2026-03-19 06:29:33,4.050000000000001,0.9,0.75,0.4,0.8,2026-03-19 06:30:35,2026-03-18
小米集团-W,1810.HK,2026-03-18 11:40:17,Stellantis (STLA) Considering Partnerships With Chinese Automakers,"Stellantis N.V. (NYSE:STLA) is one of the Cheap Stocks to Buy for High Returns in 2026. On March 12, Reuters cited a Bloomberg report noting that Stellantis N.V. (NYSE:STLA) is considering partnerships with Chinese automakers to inject cash into its underperforming European business. ​According to the report, the company’s executives have talked with Xiaomi and […]",2026-03-19 06:29:33,3.08,0.8,0.7,0.5,0.6,2026-03-19 06:30:39,2026-03-18
中国海洋石油,0883.HK,2026-03-18 11:05:19,CNOOC (SEHK:883) Valuation Check After Strong Recent Share Price Gains,"How CNOOC’s Recent Share Performance Is Drawing Investor Attention CNOOC (SEHK:883) has caught investor attention after a recent share price move, with the stock showing a 1.7% decline over the past day but double digit gains over the past month. See our latest analysis for CNOOC. Seen over a longer stretch, CNOOC’s recent 1.7% one day share price decline comes after a 12.6% 30 day share price return and a 39% 90 day share price return. The 1 year total shareholder return of 65.4% and 5 year...",2026-03-19 06:29:33,2.75,1.0,0.5,0.4,0.7,2026-03-19 06:30:43,2026-03-18
汇丰银行,0005.HK,2026-03-18 11:03:26,HSBC Raises Its Price Target on YPF Sociedad Anonima (YPF) As Analyst Turn Bullish On The Stock,"YPF Sociedad Anónima (NYSE:YPF) is one of the 8 most undervalued oil stocks to buy. Lilyanna Yang from HSBC increased the firm’s price target on YPF Sociedad Anónima (NYSE:YPF) from $36 to $40 while reiterating a Hold rating on March 12. According to the firm, the price target revision reflects its updated outlook for oil […]",2026-03-19 06:29:33,0.0,0.1,0.05,0.0,0.0,2026-03-19 06:30:47,2026-03-18
中国海洋石油,0883.HK,2026-03-18 10:52:50,SLB OneSubsea wins EPC contract from CNOOC for offshore wells,The contract involves providing integrated subsea production systems for 20 wells at the deep-water Kaiping 18-1 field in the South China Sea.,2026-03-19 06:29:33,3.7800000000000007,0.9,0.7,0.4,0.8,2026-03-19 06:30:51,2026-03-18
汇丰银行,0005.HK,2026-03-18 10:11:19,Best credit card deals of the week,"Discover the best credit cards to save money, earn rewards and travel smarter",2026-03-19 06:29:33,0.0,0.2,0.1,0.0,0.0,2026-03-19 06:30:54,2026-03-18
汇丰银行,0005.HK,2026-03-18 03:07:00,HSBC drops blunt verdict on 150-year-old dividend stock,"Eli Lilly has spent the last decade transforming from a reliable but unremarkable dividend payer into one of the most talked-about stocks on Wall Street. Its obesity and diabetes franchise, built around tirzepatide, the active ingredient in both Zepbound and Mounjaro, has sent the dividend stock ...",2026-03-19 06:29:33,0.0,0.1,0.05,0.0,0.0,2026-03-19 06:30:58,2026-03-18
比亚迪股份,1211.HK,2026-03-18 00:41:00,Here's Why BYD Stock Is a Buy Before Earnings,"BYD is facing increasing competition in China, but has a promising future abroad.",2026-03-19 06:29:33,3.15,0.9,0.7,0.4,0.6,2026-03-19 06:31:02,2026-03-18
